"annotation_id","annotator","created_at","id","label","lead_time","review","updated_at"
1,"2","2026-02-15T11:55:13.437784Z",1,"Positive",120.388,"This movie is a triumph in every sense. Highly recommended for everyone.","2026-02-15T11:55:13.437784Z"
2,"2","2026-02-15T11:55:25.705299Z",2,"Negative",11.697,"I have never been so bored in my life. The score was frankly cringe-worthy. Avoid this at all costs.","2026-02-15T11:55:25.708703Z"
3,"2","2026-02-15T11:57:42.889870Z",3,"Positive",136.615,"I was completely blown away by this film. The lead actor delivered a refreshing performance. I will be thinking about this for days.","2026-02-15T11:57:42.889870Z"
4,"2","2026-02-15T11:57:55.040297Z",4,"Negative",11.627,"The trailer was better than the movie. The acting was frankly tedious. A complete misfire.","2026-02-15T11:57:55.040297Z"
5,"2","2026-02-15T11:58:05.371124Z",5,"Negative",9.772,"Middle of the road entertainment. Visually it's fine, but the story arc is just average. It is what it is.","2026-02-15T11:58:05.371124Z"
6,"2","2026-02-15T11:58:12.745507Z",6,"Positive",6.812,"It perfectly balances humor and drama. I was hooked from the very first minute.","2026-02-15T11:58:12.745507Z"
7,"2","2026-02-15T11:58:20.593134Z",7,"Negative",7.219,"I have never been so bored in my life. Nothing about the opening scene worked. A complete misfire.","2026-02-15T11:58:20.593134Z"
8,"2","2026-02-15T11:58:33.320858Z",8,"Negative",12.132,"Nothing about the acting worked. What a complete waste of potential.","2026-02-15T11:58:33.321395Z"
9,"2","2026-02-15T11:59:02.083365Z",9,"Neutral",28.212,"It’s not a masterpiece, but it’s not a disaster either. The acting is fine, but the editing is a bit serviceable. You won't remember it a week from now.","2026-02-15T11:59:02.083365Z"
10,"2","2026-02-15T11:59:14.892375Z",10,"Positive",12.185,"Simply put, this is cinema at its finest. The chemistry between the cast was superb. Don't miss this one.","2026-02-15T11:59:14.892375Z"
11,"2","2026-02-15T11:59:27.604232Z",11,"Neutral",12.156,"I oscillated between loving and hating this film. I respect the ambition, even if it didn't fully land.","2026-02-15T11:59:27.604232Z"
12,"2","2026-02-15T11:59:39.429113Z",12,"Neutral",11.274,"The acting was gripping, yet the acting felt dull. This is a very difficult movie to categorize.","2026-02-15T11:59:39.429113Z"
13,"2","2026-02-15T11:59:55.107173Z",13,"Negative",15.102,"It tries to be deep, but comes off as dull despite the gripping music. A strange experience overall.","2026-02-15T11:59:55.107173Z"
14,"2","2026-02-15T12:00:17.729203Z",14,"Positive",22.052,"Wow, just wow. Every scene felt earned, and the costume design was masterful. Two thumbs way up.","2026-02-15T12:00:17.729203Z"
15,"2","2026-02-15T12:00:27.348959Z",15,"Neutral",9.028,"I am confused about how I feel. It left me puzzled.","2026-02-15T12:00:27.348959Z"
16,"2","2026-02-15T12:00:34.813882Z",16,"Neutral",6.903,"The direction was typical, but nothing special. Middle of the road entertainment.","2026-02-15T12:00:34.813882Z"
17,"2","2026-02-15T12:00:39.006963Z",17,"Negative",3.664,"Total garbage. Zero stars if I could give it.","2026-02-15T12:00:39.006963Z"
18,"2","2026-02-15T12:00:47.063700Z",18,"Positive",7.304,"I didn't expect to enjoy this as much as I did. I particularly loved how the cinematography was handled. Don't miss this one.","2026-02-15T12:00:47.063700Z"
19,"2","2026-02-15T12:00:54.506129Z",19,"Negative",6.852,"I tried to like it, I really did, but it failed. I walked out halfway through.","2026-02-15T12:00:54.506129Z"
20,"2","2026-02-15T12:01:07.174768Z",20,"Neutral",12.139,"I am confused about how I feel. Your mileage may vary significantly.","2026-02-15T12:01:07.174768Z"
21,"2","2026-02-15T12:01:17.999422Z",21,"Negative",10.254,"I have mixed feelings about this one. You won't remember it a week from now.","2026-02-15T12:01:17.999422Z"
22,"2","2026-02-15T12:01:24.001076Z",22,"Positive",5.47,"I didn't expect to enjoy this as much as I did. It perfectly balances humor and drama. Do yourself a favor and go see this.","2026-02-15T12:01:24.001076Z"
23,"2","2026-02-15T12:01:33.537719Z",23,"Negative",8.962,"The costume design distracted me from everything else. I struggled to sit through the first half.","2026-02-15T12:01:33.537719Z"
24,"2","2026-02-15T12:01:41.029430Z",24,"Positive",6.966,"The visual effects were superb and added so much depth. This movie is a triumph in every sense.","2026-02-15T12:01:41.029430Z"
25,"2","2026-02-15T12:02:03.560000Z",25,"Positive",21.974,"Wow, just wow. It perfectly balances humor and drama. A must-watch for fans of the genre.","2026-02-15T12:02:03.560000Z"
26,"2","2026-02-15T12:02:11.503314Z",26,"Negative",7.341,"I have never been so bored in my life. Utterly disappointing.","2026-02-15T12:02:11.503314Z"
27,"2","2026-02-15T12:02:22.827729Z",27,"Positive",10.774,"A refreshing take on a tired genre. Don't miss this one.","2026-02-15T12:02:22.828691Z"
28,"2","2026-02-15T12:03:32.710171Z",28,"Neutral",69.304,"Ideally, this should have been great, but something was off. I think I need to watch it again to decide.","2026-02-15T12:03:32.710171Z"
29,"2","2026-02-15T12:03:38.120984Z",29,"Negative",4.842,"What a complete waste of potential. It’s a hard pass from me.","2026-02-15T12:03:38.121983Z"
30,"2","2026-02-15T12:03:53.225472Z",30,"Negative",14.535,"Great concept, but the execution was jarring. It’s a weird mix of brilliance and stupidity.","2026-02-15T12:03:53.225472Z"
31,"2","2026-02-15T12:04:04.545462Z",31,"Neutral",10.796,"Ideally, this should have been great, but something was off. It tries to be deep, but comes off as amateurish despite the flawless music. I think I need to watch it again to decide.","2026-02-15T12:04:04.545462Z"
32,"2","2026-02-15T12:04:11.188800Z",32,"Neutral",6.069,"This is a very difficult movie to categorize. The first half was intense, but the ending was tedious. Your mileage may vary significantly.","2026-02-15T12:04:11.188800Z"
33,"2","2026-02-15T12:04:16.032707Z",33,"Neutral",4.297,"This is a very difficult movie to categorize. The first half was phenomenal, but the ending was cheap. It’s definitely not for everyone.","2026-02-15T12:04:16.032707Z"
34,"2","2026-02-15T12:04:21.085841Z",34,"Negative",4.467,"This might be the worst thing I've seen all year. The plot holes were glaring and the cinematography was pretentious. Avoid this at all costs.","2026-02-15T12:04:21.085841Z"
35,"2","2026-02-15T12:04:28.294895Z",35,"Neutral",6.643,"I am confused about how I feel. The first half was flawless, but the ending was nonsensical. I think I need to watch it again to decide.","2026-02-15T12:04:28.294895Z"
36,"2","2026-02-15T12:04:37.944222Z",36,"Negative",9.077,"The acting is fine, but the story arc is a bit formulaic. It was a decent way to kill an afternoon.","2026-02-15T12:04:37.944222Z"
37,"2","2026-02-15T12:04:43.365033Z",37,"Positive",4.846,"It perfectly balances humor and drama. This movie is a triumph in every sense.","2026-02-15T12:04:43.365033Z"
38,"2","2026-02-15T12:06:06.566364Z",38,"Negative",82.629,"A frustrating experience. Avoid this at all costs.","2026-02-15T12:06:06.566364Z"
39,"2","2026-02-15T12:08:22.432911Z",39,"Neutral",135.315,"A strange experience overall. While the editing shines, the rest is uninspired. It’s definitely not for everyone.","2026-02-15T12:08:22.432911Z"
40,"2","2026-02-15T12:08:29.557123Z",40,"Positive",6.551,"Every scene felt earned, and the opening scene was heartwarming. A cinematic masterpiece.","2026-02-15T12:08:29.557123Z"
41,"2","2026-02-15T12:08:38.242919Z",41,"Negative",8.112,"Visually it's fine, but the editing is just adequate. It was a decent way to kill an afternoon.","2026-02-15T12:08:38.242919Z"
42,"2","2026-02-15T12:08:45.285767Z",42,"Positive",6.496,"Wow, just wow. I particularly loved how the pacing was handled. A must-watch for fans of the genre.","2026-02-15T12:08:45.285767Z"
43,"2","2026-02-15T12:08:53.499553Z",43,"Negative",7.653,"The CGI was okay, but forgettable. I walked in with low expectations and they were met.","2026-02-15T12:08:53.499553Z"
44,"2","2026-02-15T12:09:02.274910Z",44,"Negative",8.223,"Great concept, but the execution was clichéd. Ideally, this should have been great, but something was off.","2026-02-15T12:09:02.274910Z"
45,"2","2026-02-15T12:09:07.068492Z",45,"Neutral",4.186,"I am confused about how I feel. A polarizing experience for sure.","2026-02-15T12:09:07.068492Z"
46,"2","2026-02-15T12:09:14.527523Z",46,"Negative",6.888,"I tried to like it, I really did, but it failed. The cinematography distracted me from everything else. A complete misfire.","2026-02-15T12:09:14.527523Z"
47,"2","2026-02-15T12:09:22.989922Z",47,"Neutral",7.867,"It was... fine. It has some good moments, especially the costume design. It’s okay if you have nothing else to do.","2026-02-15T12:09:22.989922Z"
48,"2","2026-02-15T12:09:28.407687Z",48,"Positive",4.854,"This movie is a triumph in every sense. The visual effects were refreshing and added so much depth. A definitive 10/10.","2026-02-15T12:09:28.407687Z"
49,"2","2026-02-15T12:09:35.039457Z",49,"Negative",6.077,"It felt like a rough draft that was never edited. I struggled to sit through the first half.","2026-02-15T12:09:35.039457Z"
50,"2","2026-02-15T12:09:44.994814Z",50,"Neutral",9.383,"Great concept, but the execution was jarring. I oscillated between loving and hating this film.","2026-02-15T12:09:44.994814Z"
51,"2","2026-02-15T12:09:48.694174Z",51,"Positive",3.087,"An absolute joy to watch from start to finish. Two thumbs way up.","2026-02-15T12:09:48.694174Z"
52,"2","2026-02-15T12:09:57.683077Z",52,"Neutral",8.416,"I'm honestly still trying to process what I just saw. The first half was heartwarming, but the ending was unbearable. Your mileage may vary significantly.","2026-02-15T12:09:57.683077Z"
53,"2","2026-02-15T12:10:05.688400Z",53,"Negative",7.446,"I tried to like it, I really did, but it failed. I couldn't get past the nonsensical soundtrack. I walked out halfway through.","2026-02-15T12:10:05.688400Z"
54,"2","2026-02-15T12:10:12.750602Z",54,"Neutral",6.449,"Ideally, this should have been great, but something was off. It’s definitely not for everyone.","2026-02-15T12:10:12.750602Z"
55,"2","2026-02-15T12:10:16.506988Z",55,"Positive",3.194,"Finally, a movie that respects the audience. Two thumbs way up.","2026-02-15T12:10:16.506988Z"
56,"2","2026-02-15T12:10:20.805197Z",56,"Neutral",3.736,"I oscillated between loving and hating this film. It’s definitely not for everyone.","2026-02-15T12:10:20.805197Z"
57,"2","2026-02-15T12:10:37.877511Z",57,"Positive",16.517,"I was completely blown away by this film. Don't miss this one.","2026-02-15T12:10:37.877511Z"
58,"2","2026-02-15T12:10:42.636479Z",58,"Positive",4.206,"Finally, a movie that respects the audience. The lead actor delivered a flawless performance. It deserves all the awards it's getting.","2026-02-15T12:10:42.636479Z"
59,"2","2026-02-15T12:10:45.861969Z",59,"Negative",2.439,"Total garbage. A complete misfire.","2026-02-15T12:10:45.861969Z"
60,"2","2026-02-15T12:10:51.835155Z",60,"Negative",5.363,"An absolute train wreck of a movie. I couldn't get past the tedious score. Zero stars if I could give it.","2026-02-15T12:10:51.835155Z"
61,"2","2026-02-15T12:11:13.992999Z",61,"Neutral",21.596,"Standard fare for this type of movie. Wait for it to come out on streaming.","2026-02-15T12:11:13.992999Z"
62,"2","2026-02-15T12:11:17.836315Z",62,"Negative",3.236,"I have never been so bored in my life. Do not bother.","2026-02-15T12:11:17.836315Z"
63,"2","2026-02-15T12:11:24.741098Z",63,"Neutral",6.344,"The acting was touching, yet the dialogue felt nonsensical. I oscillated between loving and hating this film.","2026-02-15T12:11:24.741098Z"
64,"2","2026-02-15T12:11:33.743445Z",64,"Neutral",8.437,"It doesn't leave a lasting impression. It serves its purpose as popcorn filler.","2026-02-15T12:11:33.743445Z"
65,"2","2026-02-15T12:11:40.992401Z",65,"Neutral",6.65,"It serves its purpose as popcorn filler. If you're bored, give it a shot.","2026-02-15T12:11:40.992401Z"
66,"2","2026-02-15T12:11:49.046880Z",66,"Neutral",7.486,"Standard fare for this type of movie. It doesn't leave a lasting impression. 6/10 at best.","2026-02-15T12:11:49.046880Z"
67,"2","2026-02-15T12:12:00.228524Z",67,"Neutral",10.588,"I walked in with low expectations and they were met. While the story arc was good, the rest felt so-so. Acceptable, but forgettable.","2026-02-15T12:12:00.228524Z"
68,"2","2026-02-15T12:12:06.457462Z",68,"Neutral",5.669,"It was... fine. It follows the standard formula without taking risks. If you're bored, give it a shot.","2026-02-15T12:12:06.458112Z"
69,"2","2026-02-15T12:12:11.332794Z",69,"Positive",4.312,"It managed to be flawless without trying too hard. Finally, a movie that respects the audience.","2026-02-15T12:12:11.332794Z"
70,"2","2026-02-15T12:12:15.927445Z",70,"Negative",3.987,"The soundtrack was frankly disjointed. Total garbage.","2026-02-15T12:12:15.927445Z"
71,"2","2026-02-15T12:12:20.729459Z",71,"Negative",4.236,"Great concept, but the execution was clichéd. I'm honestly still trying to process what I just saw.","2026-02-15T12:12:20.729459Z"
72,"2","2026-02-15T12:12:25.232201Z",72,"Negative",3.885,"The direction was frankly uninspired. I want my two hours back.","2026-02-15T12:12:25.232201Z"
73,"2","2026-02-15T12:12:33.480088Z",73,"Neutral",7.727,"It has some good moments, especially the direction. I have mixed feelings about this one.","2026-02-15T12:12:33.480088Z"
74,"2","2026-02-15T12:12:37.559371Z",74,"Positive",3.447,"It perfectly balances humor and drama. I was completely blown away by this film.","2026-02-15T12:12:37.559371Z"
75,"2","2026-02-15T12:12:48.225160Z",75,"Neutral",10.096,"I'm honestly still trying to process what I just saw. I respect the ambition, even if it didn't fully land.","2026-02-15T12:12:48.225160Z"
76,"2","2026-02-15T12:12:55.855134Z",76,"Positive",7.065,"A cinematic masterpiece. The visual effects were superb and added so much depth. Do yourself a favor and go see this.","2026-02-15T12:12:55.855134Z"
77,"2","2026-02-15T12:12:59.939107Z",77,"Positive",3.412,"I didn't expect to enjoy this as much as I did. Highly recommended for everyone.","2026-02-15T12:12:59.939107Z"
78,"2","2026-02-15T12:13:05.159937Z",78,"Positive",4.603,"Standard fare for this type of movie. Good for a one-time watch.","2026-02-15T12:13:05.159937Z"
79,"2","2026-02-15T12:13:12.634499Z",79,"Negative",6.942,"The plot holes were glaring and the direction was lifeless. What a complete waste of potential.","2026-02-15T12:13:12.634499Z"
80,"2","2026-02-15T12:13:19.642695Z",80,"Neutral",6.456,"A strange experience overall. I respect the ambition, even if it didn't fully land.","2026-02-15T12:13:19.642695Z"
81,"2","2026-02-15T12:13:24.101144Z",81,"Neutral",3.904,"A strange experience overall. A polarizing experience for sure.","2026-02-15T12:13:24.101144Z"
82,"2","2026-02-15T12:13:30.553157Z",82,"Neutral",5.911,"I am confused about how I feel. It tries to be deep, but comes off as clichéd despite the refreshing music. I think I need to watch it again to decide.","2026-02-15T12:13:30.553157Z"
83,"2","2026-02-15T12:13:33.806578Z",83,"Neutral",2.652,"I have mixed feelings about this one. 6/10 at best.","2026-02-15T12:13:33.806578Z"
84,"2","2026-02-15T12:13:37.774824Z",84,"Negative",3.415,"I struggled to sit through the first half. A complete misfire.","2026-02-15T12:13:37.774824Z"
85,"2","2026-02-15T12:13:41.129341Z",85,"Positive",2.771,"An absolute joy to watch from start to finish. Highly recommended for everyone.","2026-02-15T12:13:41.129341Z"
86,"2","2026-02-15T12:13:46.231296Z",86,"Negative",4.514,"A frustrating experience. Zero stars if I could give it.","2026-02-15T12:13:46.231296Z"
87,"2","2026-02-15T12:14:06.646309Z",87,"Negative",19.85,"An absolute train wreck of a movie. Nothing about the opening scene worked. I wouldn't recommend this to my worst enemy.","2026-02-15T12:14:06.646309Z"
88,"2","2026-02-15T12:14:15.153656Z",88,"Neutral",7.882,"It was... fine. It has some good moments, especially the character development. It is what it is.","2026-02-15T12:14:15.158564Z"
89,"2","2026-02-15T12:14:19.889719Z",89,"Negative",4.123,"An absolute train wreck of a movie. The dialogue distracted me from everything else. Zero stars if I could give it.","2026-02-15T12:14:19.889719Z"
90,"2","2026-02-15T12:14:24.419270Z",90,"Positive",3.947,"This movie is a triumph in every sense. The lead actor delivered a memorable performance. Don't miss this one.","2026-02-15T12:14:24.419270Z"
91,"2","2026-02-15T12:14:28.492812Z",91,"Neutral",3.498,"The screenplay was okay, but forgettable. It was... fine.","2026-02-15T12:14:28.492812Z"
92,"2","2026-02-15T12:14:31.254500Z",92,"Positive",2.191,"A cinematic masterpiece. The lead actor delivered a gripping performance. I will be thinking about this for days.","2026-02-15T12:14:31.254500Z"
93,"2","2026-02-15T12:14:37.364524Z",93,"Positive",5.523,"I was hooked from the very first minute. It managed to be vibrant without trying too hard. I can't wait to see it again.","2026-02-15T12:14:37.364524Z"
94,"2","2026-02-15T12:14:41.896487Z",94,"Neutral",3.838,"It doesn't leave a lasting impression. Middle of the road entertainment.","2026-02-15T12:14:41.896487Z"
95,"2","2026-02-15T12:14:48.216322Z",95,"Neutral",5.779,"It’s a weird mix of brilliance and stupidity. It tries to be deep, but comes off as jarring despite the iconic music. It’s definitely not for everyone.","2026-02-15T12:14:48.216322Z"
96,"2","2026-02-15T12:14:53.787644Z",96,"Neutral",4.848,"While the lighting shines, the rest is convoluted. I am confused about how I feel.","2026-02-15T12:14:53.787644Z"
97,"2","2026-02-15T12:14:58.879050Z",97,"Neutral",4.175,"It’s a weird mix of brilliance and stupidity. While the screenplay shines, the rest is tedious. A polarizing experience for sure.","2026-02-15T12:14:58.879050Z"
98,"2","2026-02-15T12:15:04.687622Z",98,"Neutral",4.942,"The acting is fine, but the costume design is a bit middle-of-the-road. It’s not a masterpiece, but it’s not a disaster either.","2026-02-15T12:15:04.687622Z"
99,"2","2026-02-15T12:15:10.019324Z",99,"Neutral",4.379,"It’s a weird mix of brilliance and stupidity. While the screenplay shines, the rest is forgetable. I respect the ambition, even if it didn't fully land.","2026-02-15T12:15:10.019324Z"
100,"2","2026-02-15T12:15:15.534549Z",100,"Positive",4.795,"I was hooked from the very first minute. I can't wait to see it again.","2026-02-15T12:15:15.534549Z"
